{
  "$defs": {
    "Market": {
      "enum": [
        "SPOT",
        "USD_M_PERPETUAL"
      ],
      "title": "Market",
      "type": "string"
    },
    "PriceLevel": {
      "additionalProperties": false,
      "description": "A single price level in the order book.\n\nquantity represents the absolute quantity at this price level after the update.\nquantity == \"0\" means this price level should be removed.",
      "properties": {
        "price": {
          "pattern": "^(0|[1-9][0-9]*)(\\.[0-9]+)?$",
          "title": "Price",
          "type": "string"
        },
        "quantity": {
          "pattern": "^(0|[1-9][0-9]*)(\\.[0-9]+)?$",
          "title": "Quantity",
          "type": "string"
        }
      },
      "required": [
        "price",
        "quantity"
      ],
      "title": "PriceLevel",
      "type": "object"
    },
    "QualityFlag": {
      "description": "Quality flags describe data facts — what is observed about the data.\n\nThese are distinct from ReasonCode which explains Health state judgments.",
      "enum": [
        "DUPLICATE",
        "OUT_OF_ORDER",
        "SEQUENCE_GAP",
        "ORDERBOOK_RESYNC",
        "SNAPSHOT_BRIDGE_PENDING",
        "SNAPSHOT_TOO_OLD",
        "BOOTSTRAP_BUFFER_OVERFLOW",
        "RECOVERED_TAIL",
        "MALFORMED_PAYLOAD",
        "EXCHANGE_TIME_MISSING",
        "RECEIVE_CLOCK_DISCONTINUITY",
        "SLOW_CONSUMER_GAP",
        "PRODUCER_RESTART",
        "OVERLAP",
        "IDENTITY_CONFLICT",
        "CROSSED_BOOK"
      ],
      "title": "QualityFlag",
      "type": "string"
    },
    "Venue": {
      "enum": [
        "BINANCE"
      ],
      "title": "Venue",
      "type": "string"
    }
  },
  "$id": "urn:binance-market-data-contracts:exchange-depth-snapshot.v1",
  "$schema": "https://json-schema.org/draft/2020-12/schema",
  "additionalProperties": false,
  "description": "REST depth snapshot from Binance.\n\nA point-in-time limited-depth snapshot used for initialization,\nrecovery, and validation. This is NOT a continuous full-depth stream.",
  "properties": {
    "asks": {
      "default": [],
      "items": {
        "$ref": "#/$defs/PriceLevel"
      },
      "type": "array"
    },
    "bids": {
      "default": [],
      "items": {
        "$ref": "#/$defs/PriceLevel"
      },
      "type": "array"
    },
    "exchange_transaction_time_ms": {
      "anyOf": [
        {
          "minimum": 0,
          "type": "integer"
        },
        {
          "type": "null"
        }
      ],
      "default": null
    },
    "last_update_id": {
      "minimum": 0,
      "type": "integer"
    },
    "market": {
      "$ref": "#/$defs/Market"
    },
    "producer": {
      "maxLength": 256,
      "minLength": 1,
      "type": "string"
    },
    "producer_version": {
      "maxLength": 256,
      "minLength": 1,
      "type": "string"
    },
    "quality_flags": {
      "default": [],
      "items": {
        "$ref": "#/$defs/QualityFlag"
      },
      "type": "array"
    },
    "receive_monotonic_ns": {
      "anyOf": [
        {
          "minimum": 0,
          "type": "integer"
        },
        {
          "type": "null"
        }
      ],
      "default": null
    },
    "receive_time_utc_ns": {
      "anyOf": [
        {
          "minimum": 0,
          "type": "integer"
        },
        {
          "type": "null"
        }
      ],
      "default": null
    },
    "request_id": {
      "maxLength": 128,
      "minLength": 1,
      "type": "string"
    },
    "schema_version": {
      "const": "exchange-depth-snapshot.v1",
      "default": "exchange-depth-snapshot.v1",
      "type": "string"
    },
    "symbol": {
      "maxLength": 20,
      "minLength": 2,
      "pattern": "^[A-Z0-9]+$",
      "type": "string"
    },
    "venue": {
      "$ref": "#/$defs/Venue"
    }
  },
  "required": [
    "venue",
    "market",
    "symbol",
    "producer",
    "producer_version",
    "request_id",
    "last_update_id"
  ],
  "type": "object"
}
